{
  "provider": "safespring",
  "fetched_at": "2026-01-29T12:00:00.000Z",
  "source": "safespring.com/en/price",
  "manual": true,
  "control_plane_cost": 0,
  "instances": [
    {
      "id": "b2-c1r2",
      "name": "b2.c1r2",
      "vcpu": 1,
      "ram_gb": 2,
      "disk_gb": 0,
      "disk_type": "network",
      "price_hourly": 0.0235,
      "price_monthly": 16.91,
      "currency": "EUR",
      "architecture": "x86",
      "location": "eu",
      "category": "standard"
    },
    {
      "id": "b2-c1r4",
      "name": "b2.c1r4",
      "vcpu": 1,
      "ram_gb": 4,
      "disk_gb": 0,
      "disk_type": "network",
      "price_hourly": 0.0371,
      "price_monthly": 26.70,
      "currency": "EUR",
      "architecture": "x86",
      "location": "eu",
      "category": "standard"
    },
    {
      "id": "b2-c2r4",
      "name": "b2.c2r4",
      "vcpu": 2,
      "ram_gb": 4,
      "disk_gb": 0,
      "disk_type": "network",
      "price_hourly": 0.047,
      "price_monthly": 33.82,
      "currency": "EUR",
      "architecture": "x86",
      "location": "eu",
      "category": "standard"
    },
    {
      "id": "b2-c2r8",
      "name": "b2.c2r8",
      "vcpu": 2,
      "ram_gb": 8,
      "disk_gb": 0,
      "disk_type": "network",
      "price_hourly": 0.0742,
      "price_monthly": 53.40,
      "currency": "EUR",
      "architecture": "x86",
      "location": "eu",
      "category": "standard"
    },
    {
      "id": "b2-c4r8",
      "name": "b2.c4r8",
      "vcpu": 4,
      "ram_gb": 8,
      "disk_gb": 0,
      "disk_type": "network",
      "price_hourly": 0.0939,
      "price_monthly": 67.64,
      "currency": "EUR",
      "architecture": "x86",
      "location": "eu",
      "category": "standard"
    },
    {
      "id": "b2-c4r16",
      "name": "b2.c4r16",
      "vcpu": 4,
      "ram_gb": 16,
      "disk_gb": 0,
      "disk_type": "network",
      "price_hourly": 0.1483,
      "price_monthly": 106.80,
      "currency": "EUR",
      "architecture": "x86",
      "location": "eu",
      "category": "standard"
    },
    {
      "id": "b2-c8r16",
      "name": "b2.c8r16",
      "vcpu": 8,
      "ram_gb": 16,
      "disk_gb": 0,
      "disk_type": "network",
      "price_hourly": 0.1879,
      "price_monthly": 135.28,
      "currency": "EUR",
      "architecture": "x86",
      "location": "eu",
      "category": "standard"
    },
    {
      "id": "b2-c8r32",
      "name": "b2.c8r32",
      "vcpu": 8,
      "ram_gb": 32,
      "disk_gb": 0,
      "disk_type": "network",
      "price_hourly": 0.2967,
      "price_monthly": 213.60,
      "currency": "EUR",
      "architecture": "x86",
      "location": "eu",
      "category": "standard"
    },
    {
      "id": "b2-c16r32",
      "name": "b2.c16r32",
      "vcpu": 16,
      "ram_gb": 32,
      "disk_gb": 0,
      "disk_type": "network",
      "price_hourly": 0.3758,
      "price_monthly": 270.56,
      "currency": "EUR",
      "architecture": "x86",
      "location": "eu",
      "category": "standard"
    },
    {
      "id": "b2-c16r64",
      "name": "b2.c16r64",
      "vcpu": 16,
      "ram_gb": 64,
      "disk_gb": 0,
      "disk_type": "network",
      "price_hourly": 0.5933,
      "price_monthly": 427.20,
      "currency": "EUR",
      "architecture": "x86",
      "location": "eu",
      "category": "standard"
    },
    {
      "id": "l2-c2r4-100",
      "name": "l2.c2r4.100",
      "vcpu": 2,
      "ram_gb": 4,
      "disk_gb": 100,
      "disk_type": "nvme",
      "price_hourly": 0.0593,
      "price_monthly": 42.72,
      "currency": "EUR",
      "architecture": "x86",
      "location": "eu",
      "category": "local-storage"
    },
    {
      "id": "l2-c2r4-500",
      "name": "l2.c2r4.500",
      "vcpu": 2,
      "ram_gb": 4,
      "disk_gb": 500,
      "disk_type": "nvme",
      "price_hourly": 0.1088,
      "price_monthly": 78.32,
      "currency": "EUR",
      "architecture": "x86",
      "location": "eu",
      "category": "local-storage"
    },
    {
      "id": "l2-c4r8-100",
      "name": "l2.c4r8.100",
      "vcpu": 4,
      "ram_gb": 8,
      "disk_gb": 100,
      "disk_type": "nvme",
      "price_hourly": 0.1063,
      "price_monthly": 76.54,
      "currency": "EUR",
      "architecture": "x86",
      "location": "eu",
      "category": "local-storage"
    },
    {
      "id": "l2-c4r8-500",
      "name": "l2.c4r8.500",
      "vcpu": 4,
      "ram_gb": 8,
      "disk_gb": 500,
      "disk_type": "nvme",
      "price_hourly": 0.1558,
      "price_monthly": 112.14,
      "currency": "EUR",
      "architecture": "x86",
      "location": "eu",
      "category": "local-storage"
    },
    {
      "id": "l2-c8r16-100",
      "name": "l2.c8r16.100",
      "vcpu": 8,
      "ram_gb": 16,
      "disk_gb": 100,
      "disk_type": "nvme",
      "price_hourly": 0.2003,
      "price_monthly": 144.18,
      "currency": "EUR",
      "architecture": "x86",
      "location": "eu",
      "category": "local-storage"
    },
    {
      "id": "l2-c8r16-500",
      "name": "l2.c8r16.500",
      "vcpu": 8,
      "ram_gb": 16,
      "disk_gb": 500,
      "disk_type": "nvme",
      "price_hourly": 0.2497,
      "price_monthly": 179.78,
      "currency": "EUR",
      "architecture": "x86",
      "location": "eu",
      "category": "local-storage"
    },
    {
      "id": "l2-c16r32-100",
      "name": "l2.c16r32.100",
      "vcpu": 16,
      "ram_gb": 32,
      "disk_gb": 100,
      "disk_type": "nvme",
      "price_hourly": 0.3881,
      "price_monthly": 279.46,
      "currency": "EUR",
      "architecture": "x86",
      "location": "eu",
      "category": "local-storage"
    },
    {
      "id": "l2-c16r32-500",
      "name": "l2.c16r32.500",
      "vcpu": 16,
      "ram_gb": 32,
      "disk_gb": 500,
      "disk_type": "nvme",
      "price_hourly": 0.4376,
      "price_monthly": 315.06,
      "currency": "EUR",
      "architecture": "x86",
      "location": "eu",
      "category": "local-storage"
    },
    {
      "id": "l2-c32r64-1000",
      "name": "l2.c32r64.1000",
      "vcpu": 32,
      "ram_gb": 64,
      "disk_gb": 1000,
      "disk_type": "nvme",
      "price_hourly": 0.875,
      "price_monthly": 630.12,
      "currency": "EUR",
      "architecture": "x86",
      "location": "eu",
      "category": "local-storage"
    }
  ],
  "gpu_instances": [
    {
      "id": "l2-c4r16-125-gA2",
      "name": "l2.c4r16.125.gA2",
      "vcpu": 4,
      "ram_gb": 16,
      "disk_gb": 125,
      "gpu": "NVIDIA A2",
      "gpu_count": 1,
      "price_monthly": 297.71,
      "currency": "EUR"
    },
    {
      "id": "l2-c8r32-250-gA2",
      "name": "l2.c8r32.250.gA2",
      "vcpu": 8,
      "ram_gb": 32,
      "disk_gb": 250,
      "gpu": "NVIDIA A2",
      "gpu_count": 1,
      "price_monthly": 415.63,
      "currency": "EUR"
    },
    {
      "id": "b2-c4r8-gA2",
      "name": "b2.c4r8.gA2",
      "vcpu": 4,
      "ram_gb": 8,
      "disk_gb": 0,
      "gpu": "NVIDIA A2",
      "gpu_count": 1,
      "price_monthly": 247.42,
      "currency": "EUR"
    },
    {
      "id": "b2-c8r16-gA2",
      "name": "b2.c8r16.gA2",
      "vcpu": 8,
      "ram_gb": 16,
      "disk_gb": 0,
      "gpu": "NVIDIA A2",
      "gpu_count": 1,
      "price_monthly": 315.06,
      "currency": "EUR"
    }
  ],
  "block_storage": {
    "price_per_gb_monthly": 0.1068,
    "ssd_price_per_gb_monthly": 0.3204,
    "currency": "EUR",
    "type": "HDD (3-replica Ceph)",
    "notes": "HDD €0.1068/GB, SSD €0.3204/GB"
  },
  "object_storage": {
    "price_per_gb_monthly": 0.04450,
    "archive_price_per_gb_monthly": 0.03115,
    "currency": "EUR",
    "type": "S3-compatible",
    "notes": "Standard €44.50/TB, Archive €31.15/TB"
  },
  "egress": {
    "free_tb": "unlimited",
    "price_per_gb": 0,
    "notes": "Zero egress fees - no traffic cost for data sent to or from services"
  },
  "notes": "Swedish cloud provider. b2 flavors use network storage, l2 flavors have local NVMe. GPU options with NVIDIA A2."
}
