{
  "provider": "exoscale",
  "fetched_at": "2026-01-25T19:32:50.875Z",
  "source": "static",
  "manual": true,
  "control_plane_cost": 30.44,
  "instances": [
    {
      "id": "cpu.extra-large",
      "name": "CPU Extra-Large",
      "vcpu": 8,
      "ram_gb": 16,
      "disk_gb": 10,
      "disk_type": "ssd",
      "price_hourly": 0.134,
      "price_monthly": 97.82,
      "currency": "EUR",
      "architecture": "x86",
      "location": "eu",
      "category": "compute"
    },
    {
      "id": "cpu.huge",
      "name": "CPU Huge",
      "vcpu": 16,
      "ram_gb": 32,
      "disk_gb": 10,
      "disk_type": "ssd",
      "price_hourly": 0.268,
      "price_monthly": 195.64,
      "currency": "EUR",
      "architecture": "x86",
      "location": "eu",
      "category": "compute"
    },
    {
      "id": "cpu.mega",
      "name": "CPU Mega",
      "vcpu": 32,
      "ram_gb": 64,
      "disk_gb": 10,
      "disk_type": "ssd",
      "price_hourly": 0.536,
      "price_monthly": 391.28,
      "currency": "EUR",
      "architecture": "x86",
      "location": "eu",
      "category": "compute"
    },
    {
      "id": "cpu.titan",
      "name": "CPU Titan",
      "vcpu": 40,
      "ram_gb": 128,
      "disk_gb": 10,
      "disk_type": "ssd",
      "price_hourly": 0.702,
      "price_monthly": 512.46,
      "currency": "EUR",
      "architecture": "x86",
      "location": "eu",
      "category": "compute"
    },
    {
      "id": "cpu.titan-48c",
      "name": "CPU Titan 48C",
      "vcpu": 48,
      "ram_gb": 128,
      "disk_gb": 10,
      "disk_type": "ssd",
      "price_hourly": 0.836,
      "price_monthly": 610.28,
      "currency": "EUR",
      "architecture": "x86",
      "location": "eu",
      "category": "compute"
    },
    {
      "id": "cpu.colossus",
      "name": "CPU Colossus",
      "vcpu": 80,
      "ram_gb": 320,
      "disk_gb": 10,
      "disk_type": "ssd",
      "price_hourly": 1.404,
      "price_monthly": 1024.92,
      "currency": "EUR",
      "architecture": "x86",
      "location": "eu",
      "category": "compute"
    },
    {
      "id": "memory.extra-large",
      "name": "Memory Extra-Large",
      "vcpu": 2,
      "ram_gb": 16,
      "disk_gb": 10,
      "disk_type": "ssd",
      "price_hourly": 0.0753,
      "price_monthly": 54.97,
      "currency": "EUR",
      "architecture": "x86",
      "location": "eu",
      "category": "memory"
    },
    {
      "id": "memory.huge",
      "name": "Memory Huge",
      "vcpu": 4,
      "ram_gb": 32,
      "disk_gb": 10,
      "disk_type": "ssd",
      "price_hourly": 0.1507,
      "price_monthly": 110.01,
      "currency": "EUR",
      "architecture": "x86",
      "location": "eu",
      "category": "memory"
    },
    {
      "id": "memory.mega",
      "name": "Memory Mega",
      "vcpu": 8,
      "ram_gb": 64,
      "disk_gb": 10,
      "disk_type": "ssd",
      "price_hourly": 0.3014,
      "price_monthly": 220.02,
      "currency": "EUR",
      "architecture": "x86",
      "location": "eu",
      "category": "memory"
    },
    {
      "id": "memory.titan",
      "name": "Memory Titan",
      "vcpu": 12,
      "ram_gb": 128,
      "disk_gb": 10,
      "disk_type": "ssd",
      "price_hourly": 0.4521,
      "price_monthly": 330.03,
      "currency": "EUR",
      "architecture": "x86",
      "location": "eu",
      "category": "memory"
    },
    {
      "id": "standard.micro",
      "name": "Micro",
      "vcpu": 1,
      "ram_gb": 0.5,
      "disk_gb": 10,
      "disk_type": "ssd",
      "price_hourly": 0.007,
      "price_monthly": 5.11,
      "currency": "EUR",
      "architecture": "x86",
      "location": "eu",
      "category": "standard"
    },
    {
      "id": "standard.tiny",
      "name": "Tiny",
      "vcpu": 1,
      "ram_gb": 1,
      "disk_gb": 10,
      "disk_type": "ssd",
      "price_hourly": 0.0146,
      "price_monthly": 10.66,
      "currency": "EUR",
      "architecture": "x86",
      "location": "eu",
      "category": "standard"
    },
    {
      "id": "standard.small",
      "name": "Small",
      "vcpu": 2,
      "ram_gb": 2,
      "disk_gb": 10,
      "disk_type": "ssd",
      "price_hourly": 0.0209,
      "price_monthly": 15.26,
      "currency": "EUR",
      "architecture": "x86",
      "location": "eu",
      "category": "standard"
    },
    {
      "id": "standard.medium",
      "name": "Medium",
      "vcpu": 2,
      "ram_gb": 4,
      "disk_gb": 10,
      "disk_type": "ssd",
      "price_hourly": 0.0418,
      "price_monthly": 30.51,
      "currency": "EUR",
      "architecture": "x86",
      "location": "eu",
      "category": "standard"
    },
    {
      "id": "standard.large",
      "name": "Large",
      "vcpu": 4,
      "ram_gb": 8,
      "disk_gb": 10,
      "disk_type": "ssd",
      "price_hourly": 0.0835,
      "price_monthly": 60.96,
      "currency": "EUR",
      "architecture": "x86",
      "location": "eu",
      "category": "standard"
    },
    {
      "id": "standard.extra-large",
      "name": "Extra-Large",
      "vcpu": 4,
      "ram_gb": 16,
      "disk_gb": 10,
      "disk_type": "ssd",
      "price_hourly": 0.1005,
      "price_monthly": 73.37,
      "currency": "EUR",
      "architecture": "x86",
      "location": "eu",
      "category": "standard"
    },
    {
      "id": "standard.huge",
      "name": "Huge",
      "vcpu": 8,
      "ram_gb": 32,
      "disk_gb": 10,
      "disk_type": "ssd",
      "price_hourly": 0.201,
      "price_monthly": 146.73,
      "currency": "EUR",
      "architecture": "x86",
      "location": "eu",
      "category": "standard"
    },
    {
      "id": "standard.mega",
      "name": "Mega",
      "vcpu": 12,
      "ram_gb": 64,
      "disk_gb": 10,
      "disk_type": "ssd",
      "price_hourly": 0.334,
      "price_monthly": 243.82,
      "currency": "EUR",
      "architecture": "x86",
      "location": "eu",
      "category": "standard"
    },
    {
      "id": "standard.titan",
      "name": "Titan",
      "vcpu": 16,
      "ram_gb": 128,
      "disk_gb": 10,
      "disk_type": "ssd",
      "price_hourly": 0.468,
      "price_monthly": 341.64,
      "currency": "EUR",
      "architecture": "x86",
      "location": "eu",
      "category": "standard"
    },
    {
      "id": "standard.jumbo",
      "name": "Jumbo",
      "vcpu": 24,
      "ram_gb": 225,
      "disk_gb": 10,
      "disk_type": "ssd",
      "price_hourly": 0.636,
      "price_monthly": 464.28,
      "currency": "EUR",
      "architecture": "x86",
      "location": "eu",
      "category": "standard"
    },
    {
      "id": "standard.colossus",
      "name": "Colossus",
      "vcpu": 40,
      "ram_gb": 320,
      "disk_gb": 10,
      "disk_type": "ssd",
      "price_hourly": 1.006,
      "price_monthly": 734.38,
      "currency": "EUR",
      "architecture": "x86",
      "location": "eu",
      "category": "standard"
    }
  ],
  "load_balancer": {
    "price_monthly": 25.33
  },
  "block_storage": {
    "price_per_gb_monthly": 0.1
  },
  "egress": {
    "free_gb_per_instance_hour": 1.42,
    "price_per_gb": 0.02,
    "notes": "Free tier per instance, then €0.02/GB"
  },
  "object_storage": {
    "price_per_gb_monthly": 0.018,
    "type": "SOS (Simple Object Storage)",
    "min_object_size_kb": 128,
    "notes": "Tiered pricing: €0.018/GB up to 512TiB, cheaper for larger volumes. 128KB minimum object billing."
  }
}