{
  "provider": "ovh",
  "fetched_at": "2026-01-25T19:32:50.874Z",
  "source": "static",
  "manual": true,
  "control_plane_cost": 0,
  "instances": [
    {
      "id": "d2-2",
      "name": "D2-2",
      "vcpu": 1,
      "ram_gb": 2,
      "disk_gb": 25,
      "price_monthly": 7.2,
      "category": "burstable",
      "disk_type": "ssd",
      "price_hourly": 0.0099,
      "currency": "EUR",
      "architecture": "x86",
      "location": "eu"
    },
    {
      "id": "d2-4",
      "name": "D2-4",
      "vcpu": 2,
      "ram_gb": 4,
      "disk_gb": 50,
      "price_monthly": 14.4,
      "category": "burstable",
      "disk_type": "ssd",
      "price_hourly": 0.0197,
      "currency": "EUR",
      "architecture": "x86",
      "location": "eu"
    },
    {
      "id": "d2-8",
      "name": "D2-8",
      "vcpu": 4,
      "ram_gb": 8,
      "disk_gb": 50,
      "price_monthly": 25.92,
      "category": "burstable",
      "disk_type": "ssd",
      "price_hourly": 0.0355,
      "currency": "EUR",
      "architecture": "x86",
      "location": "eu"
    },
    {
      "id": "c2-7",
      "name": "C2-7",
      "vcpu": 2,
      "ram_gb": 7,
      "disk_gb": 50,
      "price_monthly": 34,
      "category": "compute",
      "disk_type": "ssd",
      "price_hourly": 0.0466,
      "currency": "EUR",
      "architecture": "x86",
      "location": "eu"
    },
    {
      "id": "c3-4",
      "name": "C3-4",
      "vcpu": 2,
      "ram_gb": 4,
      "disk_gb": 50,
      "price_monthly": 30.3,
      "category": "compute",
      "disk_type": "ssd",
      "price_hourly": 0.0415,
      "currency": "EUR",
      "architecture": "x86",
      "location": "eu"
    },
    {
      "id": "c2-15",
      "name": "C2-15",
      "vcpu": 4,
      "ram_gb": 15,
      "disk_gb": 100,
      "price_monthly": 68.2,
      "category": "compute",
      "disk_type": "ssd",
      "price_hourly": 0.0934,
      "currency": "EUR",
      "architecture": "x86",
      "location": "eu"
    },
    {
      "id": "c3-8",
      "name": "C3-8",
      "vcpu": 4,
      "ram_gb": 8,
      "disk_gb": 100,
      "price_monthly": 59.76,
      "category": "compute",
      "disk_type": "ssd",
      "price_hourly": 0.0819,
      "currency": "EUR",
      "architecture": "x86",
      "location": "eu"
    },
    {
      "id": "c2-30",
      "name": "C2-30",
      "vcpu": 8,
      "ram_gb": 30,
      "disk_gb": 200,
      "price_monthly": 136.4,
      "category": "compute",
      "disk_type": "ssd",
      "price_hourly": 0.1868,
      "currency": "EUR",
      "architecture": "x86",
      "location": "eu"
    },
    {
      "id": "c3-16",
      "name": "C3-16",
      "vcpu": 8,
      "ram_gb": 16,
      "disk_gb": 200,
      "price_monthly": 119.44,
      "category": "compute",
      "disk_type": "ssd",
      "price_hourly": 0.1636,
      "currency": "EUR",
      "architecture": "x86",
      "location": "eu"
    },
    {
      "id": "c2-60",
      "name": "C2-60",
      "vcpu": 16,
      "ram_gb": 60,
      "disk_gb": 400,
      "price_monthly": 272.8,
      "category": "compute",
      "disk_type": "ssd",
      "price_hourly": 0.3737,
      "currency": "EUR",
      "architecture": "x86",
      "location": "eu"
    },
    {
      "id": "c3-32",
      "name": "C3-32",
      "vcpu": 16,
      "ram_gb": 32,
      "disk_gb": 400,
      "price_monthly": 238.88,
      "category": "compute",
      "disk_type": "ssd",
      "price_hourly": 0.3272,
      "currency": "EUR",
      "architecture": "x86",
      "location": "eu"
    },
    {
      "id": "b2-7",
      "name": "B2-7",
      "vcpu": 2,
      "ram_gb": 7,
      "disk_gb": 50,
      "price_monthly": 24.2,
      "category": "general",
      "disk_type": "ssd",
      "price_hourly": 0.0332,
      "currency": "EUR",
      "architecture": "x86",
      "location": "eu"
    },
    {
      "id": "b3-8",
      "name": "B3-8",
      "vcpu": 2,
      "ram_gb": 8,
      "disk_gb": 50,
      "price_monthly": 33.48,
      "category": "general",
      "disk_type": "ssd",
      "price_hourly": 0.0459,
      "currency": "EUR",
      "architecture": "x86",
      "location": "eu"
    },
    {
      "id": "b2-15",
      "name": "B2-15",
      "vcpu": 4,
      "ram_gb": 15,
      "disk_gb": 100,
      "price_monthly": 48.4,
      "category": "general",
      "disk_type": "ssd",
      "price_hourly": 0.0663,
      "currency": "EUR",
      "architecture": "x86",
      "location": "eu"
    },
    {
      "id": "b3-16",
      "name": "B3-16",
      "vcpu": 4,
      "ram_gb": 16,
      "disk_gb": 100,
      "price_monthly": 66.96,
      "category": "general",
      "disk_type": "ssd",
      "price_hourly": 0.0917,
      "currency": "EUR",
      "architecture": "x86",
      "location": "eu"
    },
    {
      "id": "b2-30",
      "name": "B2-30",
      "vcpu": 8,
      "ram_gb": 30,
      "disk_gb": 200,
      "price_monthly": 96.8,
      "category": "general",
      "disk_type": "ssd",
      "price_hourly": 0.1326,
      "currency": "EUR",
      "architecture": "x86",
      "location": "eu"
    },
    {
      "id": "b3-32",
      "name": "B3-32",
      "vcpu": 8,
      "ram_gb": 32,
      "disk_gb": 200,
      "price_monthly": 133.92,
      "category": "general",
      "disk_type": "ssd",
      "price_hourly": 0.1835,
      "currency": "EUR",
      "architecture": "x86",
      "location": "eu"
    },
    {
      "id": "b2-60",
      "name": "B2-60",
      "vcpu": 16,
      "ram_gb": 60,
      "disk_gb": 400,
      "price_monthly": 193.6,
      "category": "general",
      "disk_type": "ssd",
      "price_hourly": 0.2652,
      "currency": "EUR",
      "architecture": "x86",
      "location": "eu"
    },
    {
      "id": "b3-64",
      "name": "B3-64",
      "vcpu": 16,
      "ram_gb": 64,
      "disk_gb": 400,
      "price_monthly": 267.84,
      "category": "general",
      "disk_type": "ssd",
      "price_hourly": 0.3669,
      "currency": "EUR",
      "architecture": "x86",
      "location": "eu"
    },
    {
      "id": "b2-120",
      "name": "B2-120",
      "vcpu": 32,
      "ram_gb": 120,
      "disk_gb": 400,
      "price_monthly": 387.2,
      "category": "general",
      "disk_type": "ssd",
      "price_hourly": 0.5304,
      "currency": "EUR",
      "architecture": "x86",
      "location": "eu"
    },
    {
      "id": "r2-15",
      "name": "R2-15",
      "vcpu": 2,
      "ram_gb": 15,
      "disk_gb": 50,
      "price_monthly": 34,
      "category": "memory",
      "disk_type": "ssd",
      "price_hourly": 0.0466,
      "currency": "EUR",
      "architecture": "x86",
      "location": "eu"
    },
    {
      "id": "r2-30",
      "name": "R2-30",
      "vcpu": 2,
      "ram_gb": 30,
      "disk_gb": 50,
      "price_monthly": 68,
      "category": "memory",
      "disk_type": "ssd",
      "price_hourly": 0.0932,
      "currency": "EUR",
      "architecture": "x86",
      "location": "eu"
    },
    {
      "id": "r3-16",
      "name": "R3-16",
      "vcpu": 2,
      "ram_gb": 16,
      "disk_gb": 50,
      "price_monthly": 39.96,
      "category": "memory",
      "disk_type": "ssd",
      "price_hourly": 0.0547,
      "currency": "EUR",
      "architecture": "x86",
      "location": "eu"
    },
    {
      "id": "r2-60",
      "name": "R2-60",
      "vcpu": 4,
      "ram_gb": 60,
      "disk_gb": 100,
      "price_monthly": 136,
      "category": "memory",
      "disk_type": "ssd",
      "price_hourly": 0.1863,
      "currency": "EUR",
      "architecture": "x86",
      "location": "eu"
    },
    {
      "id": "r3-32",
      "name": "R3-32",
      "vcpu": 4,
      "ram_gb": 32,
      "disk_gb": 100,
      "price_monthly": 79.92,
      "category": "memory",
      "disk_type": "ssd",
      "price_hourly": 0.1095,
      "currency": "EUR",
      "architecture": "x86",
      "location": "eu"
    },
    {
      "id": "r2-120",
      "name": "R2-120",
      "vcpu": 8,
      "ram_gb": 120,
      "disk_gb": 200,
      "price_monthly": 272,
      "category": "memory",
      "disk_type": "ssd",
      "price_hourly": 0.3726,
      "currency": "EUR",
      "architecture": "x86",
      "location": "eu"
    },
    {
      "id": "r3-64",
      "name": "R3-64",
      "vcpu": 8,
      "ram_gb": 64,
      "disk_gb": 200,
      "price_monthly": 159.84,
      "category": "memory",
      "disk_type": "ssd",
      "price_hourly": 0.219,
      "currency": "EUR",
      "architecture": "x86",
      "location": "eu"
    },
    {
      "id": "r3-128",
      "name": "R3-128",
      "vcpu": 16,
      "ram_gb": 128,
      "disk_gb": 400,
      "price_monthly": 319.68,
      "category": "memory",
      "disk_type": "ssd",
      "price_hourly": 0.4379,
      "currency": "EUR",
      "architecture": "x86",
      "location": "eu"
    }
  ],
  "load_balancer": {
    "price_monthly": 9.99
  },
  "block_storage": {
    "price_per_gb_monthly": 0.04
  },
  "egress": {
    "free_tb": "unlimited",
    "price_per_gb": 0,
    "notes": "Outgoing public traffic included"
  },
  "object_storage": {
    "price_per_gb_monthly": 0.0119,
    "egress_price_per_gb": 0.0119,
    "type": "S3-compatible",
    "notes": "â‚¬0.0119/GB storage. Minimum 30-day retention billed. Ingress free."
  }
}