{
  "provider": "hetzner",
  "fetched_at": "2026-01-25T19:32:47.301Z",
  "source": "static (no token)",
  "manual": true,
  "instances": [
    {
      "id": "ccx13",
      "name": "CCX13",
      "vcpu": 2,
      "ram_gb": 8,
      "disk_gb": 80,
      "disk_type": "nvme",
      "price_hourly": 0.02,
      "price_monthly": 12.49,
      "currency": "EUR",
      "architecture": "x86",
      "location": "eu",
      "category": "dedicated"
    },
    {
      "id": "ccx23",
      "name": "CCX23",
      "vcpu": 4,
      "ram_gb": 16,
      "disk_gb": 160,
      "disk_type": "nvme",
      "price_hourly": 0.0392,
      "price_monthly": 24.49,
      "currency": "EUR",
      "architecture": "x86",
      "location": "eu",
      "category": "dedicated"
    },
    {
      "id": "ccx33",
      "name": "CCX33",
      "vcpu": 8,
      "ram_gb": 32,
      "disk_gb": 240,
      "disk_type": "nvme",
      "price_hourly": 0.0777,
      "price_monthly": 48.49,
      "currency": "EUR",
      "architecture": "x86",
      "location": "eu",
      "category": "dedicated"
    },
    {
      "id": "ccx43",
      "name": "CCX43",
      "vcpu": 16,
      "ram_gb": 64,
      "disk_gb": 360,
      "disk_type": "nvme",
      "price_hourly": 0.1546,
      "price_monthly": 96.49,
      "currency": "EUR",
      "architecture": "x86",
      "location": "eu",
      "category": "dedicated"
    },
    {
      "id": "ccx53",
      "name": "CCX53",
      "vcpu": 32,
      "ram_gb": 128,
      "disk_gb": 600,
      "disk_type": "nvme",
      "price_hourly": 0.3085,
      "price_monthly": 192.49,
      "currency": "EUR",
      "architecture": "x86",
      "location": "eu",
      "category": "dedicated"
    },
    {
      "id": "ccx63",
      "name": "CCX63",
      "vcpu": 48,
      "ram_gb": 192,
      "disk_gb": 960,
      "disk_type": "nvme",
      "price_hourly": 0.4623,
      "price_monthly": 288.49,
      "currency": "EUR",
      "architecture": "x86",
      "location": "eu",
      "category": "dedicated"
    },
    {
      "id": "cax11",
      "name": "CAX11",
      "vcpu": 2,
      "ram_gb": 4,
      "disk_gb": 40,
      "disk_type": "nvme",
      "price_hourly": 0.0061,
      "price_monthly": 3.79,
      "currency": "EUR",
      "architecture": "arm64",
      "location": "eu",
      "category": "shared"
    },
    {
      "id": "cax21",
      "name": "CAX21",
      "vcpu": 4,
      "ram_gb": 8,
      "disk_gb": 80,
      "disk_type": "nvme",
      "price_hourly": 0.0104,
      "price_monthly": 6.49,
      "currency": "EUR",
      "architecture": "arm64",
      "location": "eu",
      "category": "shared"
    },
    {
      "id": "cax31",
      "name": "CAX31",
      "vcpu": 8,
      "ram_gb": 16,
      "disk_gb": 160,
      "disk_type": "nvme",
      "price_hourly": 0.02,
      "price_monthly": 12.49,
      "currency": "EUR",
      "architecture": "arm64",
      "location": "eu",
      "category": "shared"
    },
    {
      "id": "cax41",
      "name": "CAX41",
      "vcpu": 16,
      "ram_gb": 32,
      "disk_gb": 320,
      "disk_type": "nvme",
      "price_hourly": 0.0392,
      "price_monthly": 24.49,
      "currency": "EUR",
      "architecture": "arm64",
      "location": "eu",
      "category": "shared"
    },
    {
      "id": "cx23",
      "name": "CX23",
      "vcpu": 2,
      "ram_gb": 4,
      "disk_gb": 40,
      "disk_type": "nvme",
      "price_hourly": 0.0056,
      "price_monthly": 3.49,
      "currency": "EUR",
      "architecture": "x86",
      "location": "eu",
      "category": "shared"
    },
    {
      "id": "cpx22",
      "name": "CPX22",
      "vcpu": 2,
      "ram_gb": 4,
      "disk_gb": 80,
      "disk_type": "nvme",
      "price_hourly": 0.0104,
      "price_monthly": 6.49,
      "currency": "EUR",
      "architecture": "x86",
      "location": "eu",
      "category": "shared"
    },
    {
      "id": "cx33",
      "name": "CX33",
      "vcpu": 4,
      "ram_gb": 8,
      "disk_gb": 80,
      "disk_type": "nvme",
      "price_hourly": 0.0088,
      "price_monthly": 5.49,
      "currency": "EUR",
      "architecture": "x86",
      "location": "eu",
      "category": "shared"
    },
    {
      "id": "cpx32",
      "name": "CPX32",
      "vcpu": 4,
      "ram_gb": 8,
      "disk_gb": 160,
      "disk_type": "nvme",
      "price_hourly": 0.0176,
      "price_monthly": 10.99,
      "currency": "EUR",
      "architecture": "x86",
      "location": "eu",
      "category": "shared"
    },
    {
      "id": "cx43",
      "name": "CX43",
      "vcpu": 8,
      "ram_gb": 16,
      "disk_gb": 160,
      "disk_type": "nvme",
      "price_hourly": 0.0152,
      "price_monthly": 9.49,
      "currency": "EUR",
      "architecture": "x86",
      "location": "eu",
      "category": "shared"
    },
    {
      "id": "cpx42",
      "name": "CPX42",
      "vcpu": 8,
      "ram_gb": 16,
      "disk_gb": 320,
      "disk_type": "nvme",
      "price_hourly": 0.032,
      "price_monthly": 19.99,
      "currency": "EUR",
      "architecture": "x86",
      "location": "eu",
      "category": "shared"
    },
    {
      "id": "cpx52",
      "name": "CPX52",
      "vcpu": 12,
      "ram_gb": 24,
      "disk_gb": 480,
      "disk_type": "nvme",
      "price_hourly": 0.0457,
      "price_monthly": 28.49,
      "currency": "EUR",
      "architecture": "x86",
      "location": "eu",
      "category": "shared"
    },
    {
      "id": "cx53",
      "name": "CX53",
      "vcpu": 16,
      "ram_gb": 32,
      "disk_gb": 320,
      "disk_type": "nvme",
      "price_hourly": 0.028,
      "price_monthly": 17.49,
      "currency": "EUR",
      "architecture": "x86",
      "location": "eu",
      "category": "shared"
    },
    {
      "id": "cpx62",
      "name": "CPX62",
      "vcpu": 16,
      "ram_gb": 32,
      "disk_gb": 640,
      "disk_type": "nvme",
      "price_hourly": 0.0625,
      "price_monthly": 38.99,
      "currency": "EUR",
      "architecture": "x86",
      "location": "eu",
      "category": "shared"
    }
  ],
  "load_balancer": {
    "price_monthly": 5.39
  },
  "primary_ip": {
    "price_monthly": 0.5
  },
  "block_storage": {
    "price_per_gb_monthly": 0.044
  },
  "snapshots": {
    "price_per_gb_monthly": 0.011
  },
  "egress": {
    "free_tb": 20,
    "price_per_gb_overage": 0.01
  },
  "object_storage": {
    "price_per_gb_monthly": 0.005,
    "base_monthly": 4.99,
    "included_storage_tb": 1,
    "included_egress_tb": 1,
    "type": "S3-compatible",
    "notes": "€4.99/month base includes 1TB storage + 1TB egress. Overage: ~€0.005/GB storage, €0.001/GB egress"
  },
  "notes": "Set HETZNER_API_TOKEN env var for live data"
}